company_code,company_name,package_id,event_family,event_title,start_page,end_page,primary_pages,supporting_pages,all_pages,start_anchor,end_anchor,supporting_anchor,expected_outputs,is_mixed_page,is_non_contiguous,needs_manual_review,boundary_notes,evidence_excerpt
301581,黄山谷捷,301581_establishment_001,establishment,2012年谷捷有限设立及初始出资,38,39,38|39,,38|39,1、有限公司设立情况,2、股份公司设立情况,,subscription_flow|equity_snapshot,yes,no,no,"第38页披露设立决议、1,000万元货币出资、验资及工商登记；第39页上半部为设立时股权结构，下半部开始股份公司设立。","2012年6月12日，昆山谷捷以货币出资1,000万元设立谷捷有限，设立时昆山谷捷持股100%。"
301581,黄山谷捷,301581_overall_conversion_001,overall_conversion,2022年整体变更设立黄山谷捷股份有限公司,39,40,39|40,,39|40,2、股份公司设立情况,（二）发行人报告期内的股本和股东变化情况,,overall_conversion|equity_snapshot,yes,no,no,第39页上半部仍属于有限公司设立结构；整体变更材料自“2、股份公司设立情况”开始，第40页完成验资、工商登记及变更后股权结构。,"谷捷有限以2022年5月31日经审计净资产20,152.51万元按1:0.29773折为6,000万股，余额14,152.51万元计入资本公积。"
301581,黄山谷捷,301581_share_transfer_001,share_transfer_flow,2021年4月第一次股权转让,42,42,42,,42,2、2021年4月，第一次股权转让,3、2021年4月，吸收合并,,share_transfer_flow|equity_snapshot,no,no,no,本页完整披露三笔零对价股权转让及转让后结构；交易标的是发行人前身谷捷有限股权，而非昆山谷捷自身股权。,昆山谷捷将谷捷有限78%、11%、11%的股权以零对价分别转让给黄山供销集团、张俊武、周斌。
301581,黄山谷捷,301581_subscription_001,subscription_flow,2021年4月吸收合并昆山谷捷并增加注册资本,43,44,43|44,,43|44,3、2021年4月，吸收合并,"4、2021年11月，第一次增资，增资至1,714.2857万元",,subscription_flow|equity_snapshot,yes,no,yes,"吸收合并使发行人注册资本由1,000万元增至1,200万元，新增200万元由被合并方昆山谷捷账面净资产出资；按资本流量事件纳入subscription_flow。第44页下半部开始下一次增资。","谷捷有限吸收合并昆山谷捷后存续，注册资本增至1,200万元；新增实收资本200万元由被合并方昆山谷捷账面净资产出资。"
301581,黄山谷捷,301581_subscription_002,subscription_flow,"2021年11月第一次增资至1,714.2857万元",44,45,44|45,,44|45,"4、2021年11月，第一次增资，增资至1,714.2857万元","5、2022年5月，第二次增资，增资至1,804.5113万元",,subscription_flow|equity_snapshot,yes,no,no,第44页上半部仍为吸收合并结构和评估说明，下半部开始第一次增资；第45页完成验资及增资后结构后开始第二次增资。,"赛格高技术、上汽科技以22.42元/注册资本认缴新增注册资本514.2857万元，注册资本增至1,714.2857万元。"
301581,黄山谷捷,301581_subscription_003,subscription_flow,"2022年5月第二次增资至1,804.5113万元",45,46,45|46,,45|46,"5、2022年5月，第二次增资，增资至1,804.5113万元",6、2022年9月，整体变更为股份公司,,subscription_flow|equity_snapshot,yes,no,no,员工持股平台黄山佳捷认缴新增注册资本90.2256万元。第46页完成验资及增资后结构，随后仅为整体变更交叉引用，不另建事件包。,"黄山佳捷以23.55元/注册资本认缴新增注册资本90.2256万元，注册资本由1,714.2857万元增至1,804.5113万元。"
301581,黄山谷捷,301581_equity_snapshot_001,equity_snapshot,招股说明书签署日发行人股权结构图,48,49,48|49,,48|49,五、发行人的股权结构和组织结构（一）股权结构图,（二）组织结构图,,equity_snapshot,yes,no,yes,第48页页末出现股权结构图标题，第49页上部为完整关系图，随后进入组织结构图和控股子公司。结构化时只保留发行人直接股东层。,签署日直接股东为黄山供销集团、赛格高技术、张俊武、周斌、黄山佳捷和上汽科技，合计持有发行人100%股份。
301581,黄山谷捷,301581_equity_snapshot_002,equity_snapshot,本次发行前后完整股本结构,58,59,58|59,,58|59,十一、发行人股本情况（一）本次发行前后的股本情况,（二）本次发行前的前十名股东情况,,equity_snapshot,yes,no,no,第58页上半部为控股股东控制企业表的续页，目标内容从“十一、发行人股本情况”开始；第59页完成发行前后结构后进入前十名股东表。,"发行前总股本6,000万股，拟公开发行2,000万股，发行后总股本8,000万股，社会公众股占25%。"
301581,黄山谷捷,301581_equity_snapshot_003,equity_snapshot,本次发行前完整股东结构,59,59,59,,59,（二）本次发行前的前十名股东情况,（三）本次发行前的前十名自然人股东及其在公司任职情况,,equity_snapshot,yes,no,no,发行人本次发行前仅有6名股东，因此前十名股东表实际覆盖全部发行前股东；同页上半部仍属于发行前后股本结构。,"发行前6名股东合计持有6,000万股、占总股本100%。"
